{
  "schemaVersion": "capability-manifest-v1",
  "registry": {
    "registryId": "ae-host-capability-registry",
    "scope": "host-workspace",
    "canonical": true,
    "owner": "general",
    "version": "1.0.0",
    "fingerprint": "sha256:1111111111111111111111111111111111111111111111111111111111111111",
    "enabledByDefault": false
  },
  "authority": {
    "mode": "NON_AUTHORITATIVE",
    "controller": "AE",
    "canRoute": false,
    "canSelectModel": false,
    "canGrantWrite": false,
    "canCloseLifecycle": false,
    "canCreateState": false,
    "canAccessSecrets": false,
    "canFetchInstructions": false,
    "canInvokeCallbacks": false,
    "canRunArbitraryCode": false
  },
  "capabilities": [
    {
      "capabilityId": "observability",
      "provider": "Harness",
      "owner": "Harness",
      "version": "1.0.0",
      "fingerprint": "sha256:5555555555555555555555555555555555555555555555555555555555555555",
      "availability": "UNAVAILABLE",
      "enabledByDefault": false,
      "status": {
        "documented": "DOCUMENTED",
        "installed": "UNAVAILABLE",
        "runnable": "UNAVAILABLE",
        "executed": "UNAVAILABLE"
      },
      "taskCategories": ["observability", "verification"],
      "readWriteClass": "READ_ONLY",
      "scope": {
        "scopeClass": "REPOSITORY",
        "maxRepositories": 1,
        "maxPaths": 15,
        "allowedPathClasses": ["observability", "evidence"],
        "requiresAEGrant": true,
        "externalSideEffects": false
      },
      "evidenceRequirements": [
        {
          "evidenceType": "unavailable-record",
          "required": true,
          "freshness": "not-applicable",
          "description": "Record the missing host capability and the reason it cannot be run."
        },
        {
          "evidenceType": "catalog-fingerprint",
          "required": true,
          "freshness": "source-bound",
          "description": "Retain the declared identity without claiming execution."
        }
      ],
      "purpose": "Declare that sanitized observability evidence is unavailable on this host."
    }
  ]
}
